### ISSUE TITLE
Downlink packet sent at next uplink

### ISSUE THREAD

**Issue by v8088** [brocaar/loraserver#335]
I am using Lora Server v1.0.0 and Lora App Server v1.0.1.
I have an OTAA device which sends Class A confirmed uplinks.
In Node-RED I get the uplink by MQTT from the app server, generate a downlink packet and send it by MQTT back to the app server. This happens in less than a millisecond, as seen with an MQTT client.

The problem is that every downlink received by the device is for the previous uplink it sent.

I looked at the Device Queue API and there are always queued messages (one, sometimes two).

What can I do to have the downlinks synced to the uplinks? Could this be a bug ?

**Comment by v8088** [comment]
I just tested with the previous version Lora Server 0.26.3 and Lora App Server 0.21.1 and it works as expected. The downlinks are in sync with the uplinks.
In the previous version, the Device Queue has only one item. For example, downlink fCnt=4 seen in the LoRaWAN frame log, and fCnt=4 in the Device Queue.

But in version 1.0.x the Device Queue has 2 items. For ex. I see downlink fCnt=2 in the LoRaWAN frame log, and I have two items in the Device Queue with fCnt=2 and fCnt=3.

Something wrong in version 1.0.x ?

**Comment by v8088** [comment]
I know about that config option, tried it but it does not help. 

I ran more tests. 

I have everything running in a VirtualBox VM: Ubuntu 16.04, Lora Server, Lora App Server, Mosquitto, Postgres, Redis, and Node RED.
My gateway is a Multitech Multiconnect Conduit AEP, firmware 1.4.16, with the lora-gateway-bridge installed.
If I run the VM in the same LAN as the gateway, everything is running fine, al LoRa downlinks are synced to the uplinks.
But I need to run the VM remotely on a production machine, and the gateway connects to it over the internet. The ping between locations is low, approx.  9...12 ms. When I run the VM on the production machine, almost always I get the downlinks out of sync with the uplinks. Tried it with Loraserver v1.0.x and the previous version 0.2x, it behaves the same.
There is a very low delay in which the LoRa App Server gets the downlinks from Node RED. This happens virtually instantly, since both are running on the same machine (inside the VM), so the get_downlink_data_delay option is irrelevant. The only delay which occurs is the round-trip time from the gateway and back. I made a tcpdump log on the gateway and this is what I got.

`
10:53:13.089171 IP localhost.54257 > localhost.1700: UDP, length 12
E..(..@.@.I"...............'.H.........(
10:53:13.091470 IP localhost.1700 > localhost.54257: UDP, length 4
E.. ..@.@.I).................H..

10:53:16.718705 IP localhost.36756 > localhost.1700: UDP, length 202
E.....@.@.G].................F.........({"rxpk":[{"tmst":2417179620,"chan":2,"rfch":0,"freq":868.500000,"stat":1,"modu":"LORA","datr":"SF7BW125","codr":"4/5","lsnr":8.2,"rssi":-62,"size":21,"data":"gAuvjgegFAAB/fhe2tu1yjtHym7I"}]}
10:53:16.725684 IP localhost.1700 > localhost.36756: UDP, length 4
E.. ..@.@.H".................F..

10:53:17.397176 IP localhost.1700 > localhost.54257: UDP, length 242
E.....@.@.G................^M.xq.{"txpk":{"imme":false,"tmst":2418179620,"freq":868.5,"rfch":0,"powe":14,"modu":"LORA","datr":"SF7BW125","codr":"4/5","ipol":true,"size":54,"data":"oAuvjgewEwABRSrbJQsmPImkp+uxPmdhiqIxTUb88cdwabKw5LjWr6E+$
10:53:17.398729 IP localhost.54257 > localhost.1700: UDP, length 12
E..(..@.@.G................'.xq........(

10:53:22.505100 IP localhost.36756 > localhost.1700: UDP, length 202
E....u@.@.E...................<........({"rxpk":[{"tmst":2422966579,"chan":1,"rfch":0,"freq":868.300000,"stat":1,"modu":"LORA","datr":"SF7BW125","codr":"4/5","lsnr":8.8,"rssi":-59,"size":21,"data":"gAuvjgegFQABj2U+OJHaeckJhAnw"}]}
10:53:22.518006 IP localhost.1700 > localhost.36756: UDP, length 4
E.. .v@.@.FT..................<.

10:53:23.199170 IP localhost.54257 > localhost.1700: UDP, length 12
E..(.{@.@.FG...............'.@.........(
10:53:23.201616 IP localhost.1700 > localhost.54257: UDP, length 4
E.. .|@.@.FN.................@..

10:53:23.224838 IP localhost.1700 > localhost.54257: UDP, length 242
E....}@.@.E_...............^M....{"txpk":{"imme":false,"tmst":2423966579,"freq":868.3,"rfch":0,"powe":14,"modu":"LORA","datr":"SF7BW125","codr":"4/5","ipol":true,"size":54,"data":"oAuvjgewFAABVUgX47AjQKlbhccqnRacNiYJMEHyViyWnnfqp+KgVBB9$
10:53:23.225986 IP localhost.54257 > localhost.1700: UDP, length 12
E..(.~@.@.FD...............'...........(

10:53:24.347299 IP localhost.36756 > localhost.1700: UDP, length 113
E.....@.@.E..............y...~.........({"stat":{"time":"2018-06-28 07:53:24 GMT","rxnb":3,"rxok":3,"rxfw":3,"ackr":100.0,"dwnb":3,"txnb":3}}
10:53:24.359824 IP localhost.1700 > localhost.36756: UDP, length 4
E.. ..@.@.F".................~..
`

This confirms that the round-trip time is similar to the ping between the VM and gateway locations.

What could be the cause for the out-of-sync downlinks?

**Comment by v8088** [comment]
And one more log for MQTT on the Lora Server VM.


2018-06-28 12:15:16.384 {"rxInfo":{"mac":"00800000a0001c28","timestamp":3041817867,"frequency":868300000,"channel":1,"rfChain":0,"crcStatus":1,"codeRate":"4/5","rssi":-58,"loRaSNR":9.5,"size":21,"dataRate":{"modulation":"LORA","spreadFactor":7,"bandwidth":125},"board":0,"antenna":0},"phyPayload":"gEy5mgegEQABcO+eKkrtCaTaDZ1+"}
2018-06-28 12:15:16.704 {"applicationID":"2","applicationName":"field-tester-app","deviceName":"field-tester","devEUI":"0018b20000001dc1","rxInfo":[{"mac":"00800000a0001c28","rssi":-58,"loRaSNR":9.5,"name":"multitech","latitude":46.7587975674797,"longitude":23.614511489868168,"altitude":30}],"txInfo":{"frequency":868300000,"dataRate":{"modulation":"LORA","bandwidth":125,"spreadFactor":7},"adr":true,"codeRate":"4/5"},"fCnt":17,"fPort":1,"data":"ryIREA/bLQY="}
2018-06-28 12:15:16.713 {"reference":"abc","confirmed":true,"fPort":1,"data":"VGh1IEp1biAyOCAyMDE4ICAxMjoxNToxNiBHTVQrMDMwMCAoRUVTVCk="}
2018-06-28 12:15:16.720 {"applicationID":"2","applicationName":"field-tester-app","deviceName":"field-tester","devEUI":"0018b20000001dc1","reference":"abc","acknowledged":true,"fCnt":15}
2018-06-28 12:15:16.902 {"token":16282,"txInfo":{"mac":"00800000a0001c28","immediately":false,"timestamp":3042817867,"frequency":868300000,"power":14,"dataRate":{"modulation":"LORA","spreadFactor":7,"bandwidth":125},"codeRate":"4/5","iPol":null,"board":0,"antenna":0},"phyPayload":"oEy5mgewEAABGw9wV1VyMMXazVzbP+rpg7Iu3jHpTER9R9Jjjrv1JS+wly+LFwJP9IVH4x7n"}
2018-06-28 12:15:16.923 {"mac":"00800000a0001c28","token":16282}


You can see that it takes from 12:15:16.704 to 12:15:16.713 for Node RED to generate a reply to the App Server, much lower than the get_downlink_data_delay option.

But it takes from 12:15:16.384 to 12:15:16.704 for Lora Server to send the uplink the Lora App Server...  320 ms.
And it takes from 12:15:16.720 to 12:15:16.902 for the Lora App Server to send the downlink to Lora Server.  Another 182 ms.

So excluding the 9 ms it takes Node RED to generate the downlink, it takes 320 ms + 182 ms = 502 ms for a packet from Lora Server to App Server and back, on the same machine. Isn't that a little too high ??
